top_k_predictions,user_intent
"['B00CYA5QXK', 'B099MP6FFV', 'B095NQBVWW', 'B075R6ZKZZ', 'B07YSZZYBB', 'B0922S1NXL', 'B0922V2SYG', 'B08P4Y7VGQ', 'B00CXAOTCK', 'B09JRYJN4N', 'B00FF78WEE', 'B017V1C46I', 'B01CR0MY6I', 'B09Z2BXKH5', 'B07W68J6BV', 'B06X19YY8Z', 'B00U92JSQG', 'B09PMCYDZ9', 'B017V1CEE0', 'B07W46JLMX', 'B017V1CWYW', 'B0178I2OZK', 'B017V1CNNM', 'B00YSMSYEA', 'B002LZLIFI', 'B00YSNZXWK', 'B01HRZP67M', 'B017V1C8LO', 'B0B3DYL8WT', 'B072M57TSS', 'B08TVKD9P8', 'B09CVBQGJK', 'B07637HSJY', 'B09KN6JY9P', 'B07MYV957K', 'B017V1C5X0', 'B08ZYX1ZSZ', 'B0B5LPRJG4', 'B09Y5Z63LR', 'B07PJBF6PM', 'B08YR27JJ8', 'B017V1CIMI', 'B017V1D21E', 'B017V1CGHA', 'B08ZKVMB2P', 'B08TR93JQT', 'B0BHF6RYX7', 'B07JZJRSC3', 'B08P6QYH2N', 'B087JXM6RF']","Based on the user's previous purchases and preferences, it seems like they are interested in purchasing more Kilner brand glass jars for preserving jams, chutneys, and other items. They prefer jars with capacities ranging from 0.125 to 0.5 liters in clear or multicolored options. The user is looking for jars within the price range of $3.98 to $13.99. Some specific models they might be interested in include 25.402, 0025.052, 0025.496, and 25.493."
"['B09FYGY1PT', 'B09JYFCPRF', 'B0797QCXTJ', 'B09JY6YYVD', 'B07N9MDR5B', 'B07WW7KWYD', 'B07986PJ6N', 'B09JYDBBZS', 'B09JXZCQ16', 'B07SC58QBW', 'B0797RDXLD', 'B09V51F5MX', 'B09V4JB57R', 'B09JY1PWCL', 'B09JY8N4LJ', 'B08PCBMW7Y', 'B09KRPB2XT', 'B09MGGPVML', 'B08PCD9K1Q', 'B07PWFQV6X', 'B07N9DX5B9', 'B08PCD292R', 'B07N9MV9ZH', 'B09ZDGXTHK', 'B09ZLS8ZY7', 'B08PCCM1GC', 'B08PCCZB1H', 'B09MGG1C2D', 'B09MGG33KY', 'B00VQQ294C', 'B09ZDM1P67', 'B09MGFQ684', 'B08PCGL5TH', 'B08PCFV74N', 'B07PVK13D1', 'B07Z62SGTC', 'B09MGFJN9R', 'B09CLGDGTL', 'B08PCDF471', 'B0833162XM', 'B08PCDKD6G', 'B0832XHLYH', 'B09MGHJS6P', 'B09MGH16D1', 'B09MGGKCZ7', 'B08PCCZ7XT', 'B08L5R1R74', 'B00VQQSOG4', 'B08CK8YC4S', 'B08PCCKZR7']","Based on the user's previous purchases, preferred colors, price range, brands, and models, it appears that the user is likely interested in buying another Apple iPhone within the price range of $159.95 to $380.00. The user has shown a preference for colors such as Black, Midnight Green, Purple, and Space Grey. The user has purchased Apple iPhone models like the iPhone 11 and iPhone 8 in various colors and storage capacities. Considering these preferences, the user may be interested in exploring additional Apple iPhone models with similar features and specifications."
"['B0881WZWFK', 'B086YPRKRP', 'B08T9ZZBBM', 'B0B99DW4YK', 'B09VCJ7CM4', 'B07S79G11S', 'B0937ZRFGJ', 'B08YYMPM4T', 'B08S45YXNX', 'B07ST9LWB9', 'B0B294GGHJ', 'B08MWJ6WX2', 'B0B2VBG2K6', 'B0894HWG1H', 'B09387R8QW', 'B08YYMN685', 'B09N2QBDD4', 'B07RK1XGHB', 'B08C4MXZ87', 'B09VY4Q552', 'B09LCBMKDT', 'B08PYRWZZG', 'B0764MC2ZH', 'B08BFGRP1M', 'B08BLC3D7D', 'B01DY2BHNO', 'B0B2V3J7KX', 'B012CRBV6U', 'B09VDWJ1KC', 'B09WRDFPNP', 'B08PP8K9M4', 'B012CRBDJ0', 'B00DREC6D0', 'B01N9XUNVC', 'B07NSC26JF', 'B01LX1QKHM', 'B08NY6BM2F', 'B09LLSHL3B', 'B012CRBPH0', 'B09CTPXB7J', 'B092431BML', 'B08CC26CH1', 'B08HYXZ7GZ', 'B07YFWWTY7', 'B07PB14M9L', 'B09WRFWJ94', 'B086R66KL9', 'B08H1V8D6X', 'B08NXRRC76', 'B096KY61CN']","Based on your previous purchases and preferences, it seems like you are interested in items related to household cleaning and grooming. You have purchased items such as lint rollers, pet hair removers, and shaving gel. You prefer colors like black, yellow, wood, orange, purple, and white. Your price range is between $2.0 to $10.99, and you have shown interest in brands like ARVO, CIOKIT, Gillette, Mr Hsiung & Mrs Yin, and Red One. The models of the products you have bought include ARVO 3443, GMQ, 7702018464692, and AR00151, made of materials like sticky paper sheet with a plastic handle, copper, and plastic. Based on this information, you may be interested in purchasing similar products or items related to cleaning, grooming, and personal care within your preferred price range and brand preferences."
"['B00FLTE8OE', 'B017IOKN52', 'B09B28MTND', 'B07CRNCKMR', 'B018T59VIE', 'B09B2FN962', 'B08THP6Y71', 'B08THRFKWF', 'B09Y42QLQC', 'B09M3YT5R8', 'B09WF6FWL2', 'B072M59HNR', 'B07BG8RRLL', 'B08PC71W32', 'B00YHDBOYM', 'B017KHMS1E', 'B09BDC5FVZ', 'B07SYH8P5Q', 'B0B178C4PB', 'B09LHMFFM2', 'B09FWY96WC', 'B08NW6RR6C', 'B0784T65RK', 'B07F8J2S79', 'B01FI4PHOQ', 'B01A84QSRG', 'B00LV7BD98', 'B07C8V2DJ7', 'B09BDCQJ51', 'B00I9ZDDJ8', 'B08WM1Y83Z', 'B08WJT5DFS', 'B09LHK5SN8', 'B09LHGS6K9', 'B01H2T7GGM', 'B00LWU4RAG', 'B08FBJZ853', 'B0B63PHLHB', 'B06XRGMH2K', 'B096Y9XNLF', 'B00OVY4I36', 'B09LHKW259', 'B07RRPT6YM', 'B00HU0POJK', 'B000EWYCX0', 'B08GM7Y9L5', 'B00O7OWZD0', 'B0748H6D2X', 'B08NW74FDQ', 'B07DKFZ3DN']","Based on the user's previous purchases, preferred colors, price range, brands, models, and preferred materials, it seems like the user's current intent is to find another table top mini fridge in either black or silver color, within the price range of 99.99 to 129.99, from the brand Russell Hobbs, and with a steel material construction. The user may be interested in models similar to RHTTLF1B, RHTTF67SS, and RHTTF67B by Russell Hobbs."
"['B0B99T4J65', 'B09SZ5HHX5', 'B09V264TPR', 'B071XLGBLW', 'B08X96QYBS', 'B0B5XPGRXD', 'B0B6WVQJQY', 'B0B5XHRVFL', 'B0B13Q77GL', 'B0B8MHSFXD', 'B0B8QGPPW5', 'B0B9JRM847', 'B09YDJ5J9X', 'B0B7DS6FTH', 'B0B2JTCS4T', 'B09MB7KZH5', 'B09LYH3P1F', 'B09V27VYTP', 'B0B4W7K988', 'B0BHSXQLSX', 'B0BB151WK6', 'B09ZKG7RWN', 'B0B1D7662S', 'B0B9BM42SX', 'B0BBB8QQ55', 'B09N2YJW23', 'B0B9BMC2LZ', 'B09X9HH7N4', 'B09Z2V97N5', 'B0B4J8YCBF', 'B09N2YT3VN', 'B0BBB9TVTN', 'B0BBB9XZVQ', 'B0B11YY81B', 'B0BBB84C44', 'B0B1PYP4T9', 'B09N2YW2T6', 'B0B1Q2CDXG', 'B0B2538Y7T', 'B09SHNZRB3', 'B001GNBVQM', 'B09SL7NLN8', 'B0BDF1LSWW', 'B09N2YTBHG', 'B09N2Z6DBD', 'B09YRT539D', 'B0B27MTZ7J', 'B09Z2TL15S', 'B09W9BRMK5', 'B09V83Q1JK']","The user's current intent seems to be to purchase more makeup powder puffs in black or gradient colors, particularly looking for velvet and padded sponges for a comfortable and soft feel. They are likely interested in sets of multiple puffs for daily use and replacement needs. The preferred price range is 1.99 to 2.99, and they are specifically looking for products from the brand HEYMKGO. So, the user is likely interested in finding makeup powder puffs that match these criteria."
"['B081TSKCMS', 'B0BF9PYG2T', 'B081TW9XWF', 'B0B1DKHGWP', 'B082FHFCZ6', 'B09W97XFVK', 'B07FPYZ9SD', 'B07FQ6BZ5P', 'B08WRTJMYY', 'B0B59FN29S', 'B0B599X6L8', 'B0BF9VFJHN', 'B00K2UAWWO', 'B07FPZ742M', 'B07DMJG9YS', 'B0B2RS52KB', 'B0B2RVFH8G', 'B07DNW17V7', 'B014DGP9R0', 'B09PR34MF9', 'B0B59C4DKY', 'B0B24L8WFN', 'B0B8HCVNNV', 'B089KZ93YM', 'B0869GHP59', 'B08DR1PNBJ', 'B0B2RR47XV', 'B098BSY19T', 'B09WMT7C9D', 'B089KYM4MR', 'B0B2PL859V', 'B0BH3RWZ9N', 'B098BQV7MB', 'B09RLHJWM4', 'B0B2ML85NW', 'B094VM4MFL', 'B0B24SG4YR', 'B072VBQMW4', 'B0BF9R466D', 'B08MTNL9TH', 'B09RQZJFSH', 'B0B18QD4S8', 'B094VK7QL1', 'B0B594Y644', 'B0B256HNBW', 'B0B9T7PZ74', 'B098BSZSHP', 'B09RLDMTWL', 'B0835FLKRF', 'B0B9T42F59']","Based on your previous purchases of Oral-B electric toothbrushes in white and pink colors, as well as a sonic electric toothbrush in pink by Phniti, it seems like you are interested in purchasing another toothbrush in the price range of $24.99 to $105.0. Your preferred brands are Oral-B and Phniti. Based on this information, it appears that you are likely looking for a new electric toothbrush in either white or pink color. Let me know if you would like me to find some options for you!"
"['B08R7JXDSL', 'B08R7LJRD6', 'B08R7KJ6DP', 'B08R7KJBCP', 'B08R7K24BW', 'B082Y6QMQ8', 'B08R7LTDGS', 'B082Y64V39', 'B082Y6QXS3', 'B08XND7TZW', 'B0832VGT99', 'B0832TP662', 'B08TC4WGQW', 'B08TC2Q3KS', 'B0832V1DS9', 'B08TC49YHW', 'B082Y6D9RZ', 'B09639ZHNG', 'B07C7836RW', 'B09N3CGCVQ', 'B07C7LFFD5', 'B07TBJ15WJ', 'B07C7QWP4S', 'B01N1T2OLM', 'B08RD8K985', 'B09CCSZNMT', 'B09CD118C4', 'B09STC39JF', 'B01BX0VI1A', 'B08RDB1B28', 'B09GJSRZLG', 'B08CMQYFCD', 'B08RD94X8B', 'B09MRTTHC6', 'B07BF829J1', 'B09BPXK8NM', 'B07CKKJ5SW', 'B09D6PBQKF', 'B07VK57JVY', 'B08RD971Q6', 'B09D7H8DLY', 'B08SCJQHN8', 'B07CKKD8P3', 'B07Q5R5842', 'B07FMVCBX4', 'B09MRSMNFG', 'B07DCZM3MD', 'B08RD8QRW1', 'B07GVHGZNV', 'B09D6PC36V']","Based on the user's previous purchases of TAOCOCO Sofa Covers in Dark Grey, it appears that their current intent is to continue protecting their furniture with waterproof and non-slip sofa covers in the same color. They are likely looking for items within the price range of $20.99 to $32.99 and prefer products from the brand TAOCOCO. The user seems to prioritize practicality and durability in their furniture protection choices."
"['B097DXJ7YF', 'B07MH1DV2C', 'B098QY3MQL', 'B07TSM1M2J', 'B08GPRVXKC', 'B085XSDMHJ', 'B07MNLKPS5', 'B07C5HVQSL', 'B09ZJ4RBYR', 'B0B7NVMW1J', 'B09ZJ64J4H', 'B09ZLHWC1H', 'B07LBKWM5M', 'B08F6BXH48', 'B09ZLJ2R3N', 'B085XT846T', 'B08HQRX2XT', 'B075F7JYH6', 'B07TX5HGR4', 'B0859M6X8G', 'B08KTG88PJ', 'B087Q94YC3', 'B09VCK978V', 'B07RCSCRQZ', 'B07VPCBKG1', 'B08HCVZ3CW', 'B07VMCJFTM', 'B08HQZQZ78', 'B087QBLKSJ', 'B09VCLR8L7', 'B071SD2C7Z', 'B09ZJ4799Y', 'B0B21RBWJX', 'B07R94MSQN', 'B09VCN4ZN9', 'B089GQ3SV1', 'B07BSWJRBN', 'B08PQ7KPBL', 'B08HCTJS4F', 'B09BTNH9T9', 'B07M5K99F6', 'B07TX69SNH', 'B06XHS81NL', 'B01MT8HXD0', 'B09ZLL3977', 'B0B7NY5371', 'B0B7NQ8VMD', 'B01KTHYPV8', 'B08D8JTYPT', 'B09ZJ7FWSM']","It seems like the user is interested in purchasing spa and pampering gift sets and scented candles within the price range of $5.0 to $21.99, with a preference for items in rose, honey, and festive bauble bath & shower themes from brands like Spa Luxetique, Baylis & Harding, and the gift box. The user may also have a preference for wax-based products."
"['B00426D500', 'B07Z19B9NR', 'B09FB369NG', 'B08GSTY877', 'B07Y9WTHQP', 'B004FBMV5W', 'B09HKLJYTP', '0008306532', 'B0BC8HRZKH', 'B08FJ8LSWZ', 'B08XC5LFTG', 'B096SL7X61', 'B09WYVDSCH', 'B0B88C7B6X', 'B07MRVFZJ2', 'B000HWXG0M', 'B08M3DMN4Q', 'B09WYTBY2V', 'B08XKF6MQX', 'B01N8PQKYG', 'B08GYBDPTD', 'B093BCC4VP', 'B077NRD2LH', 'B077BG1ZP1', 'B09XQYMBQ8', 'B005A4VXSE', 'B096MS143K', 'B09N9ZPDL6', 'B09PMQRSPF', 'B07HYZQCPQ', 'B0168FKRS0', 'B0B1VVWSB7', 'B0015ISX0U', 'B0B7BJY5PJ', 'B01N3ZCELN', 'B01FSR76BK', 'B08XJJDPHQ', 'B07LB2HTLX', 'B00Q06B9SA', 'B0B524HG1F', 'B0B9BY2M8F', 'B088TRVWRJ', 'B087343NB9', 'B0787BDLXF', 'B08DHTP6HM', 'B08RZ8RKRB', 'B08XMCMXSP', 'B09L5B1D1H', 'B07JML5524', 'B01H7JD64S']","Based on the user's preferences and previous purchases, it seems like they are interested in family-friendly party games (including card games and board games) with a mix of fun and humor. They prefer games associated with popular TV shows or music, as well as adult card games designed for laughter and social interaction. The user seems to be open to colorful and multicolored items, with a price range between £8.90 to £20.85. The brands they have shown interest in include Mr & Mrs, Rascals, ALIXO, and Big Potato. They also seem to appreciate games made of paper materials. Based on this information, we can suggest items that align with their previous purchases and preferences in terms of type of game, theme, brand, color, and price range."
"['B0B2PN9HQ4', 'B07PZSZB19', 'B0BC8VV97Y', 'B07X5M5BVZ', 'B0B7SKYMW9', 'B07X7KDS6Y', 'B07HVY1F7W', 'B08LP6HD8V', 'B08CZCNYWZ', 'B081QWS81G', 'B0BGLB8CJK', 'B0BCVR4RNJ', 'B0002HB0HI', 'B09NC2JNSK', 'B0923KVQCY', 'B09BTTCW78', 'B07QRM4GRV', 'B07XXHR8WF', 'B0978SND7J', 'B098XM8V59', 'B07TRMGS8T', 'B0B9XQQSPX', 'B09BTKK3ZR', 'B09VZ9DP67', 'B0BCZ7PFL7', 'B07H7G5QHP', 'B083W1BWPQ', 'B08SBSQV6B', 'B09N323PFT', 'B08HCV3K6W', 'B07MV536LW', 'B07XXJLJ4B', 'B0B9M9QL71', 'B07ZYC25X3', 'B0B81ZLWL5', 'B09GRN3SNL', 'B07JML5524', 'B07VPSWKCB', 'B08QJLPGLM', 'B0B6QYRZW4', 'B07Y3FZDW3', 'B0007VTA5S', 'B0BJPYSW4B', 'B09G6R873X', 'B09W5VQ9J3', 'B0B3T5L8KS', 'B099FL67ZX', 'B09N7S91YD', 'B00DTXIKJS', 'B0BFXB8VT8']","Based on the user's previous purchases and preferences, it seems like their current intent is to find items related to games for kids, kitchen gadgets, and household tools within the price range of $8.41 to $28.99. They have shown an interest in items with colors such as blue, grey, and white, from brands like Kids Play, Toskope, and Toskope. They have also purchased items made of materials like cardboard and plastic."
"['B08B5YWNF7', 'B09HVLS4Q9', 'B09Y2JT879', 'B09HVMCJ4B', 'B09Y2K7W8K', 'B0BJ1893RX', 'B0B5LYXDZV', 'B08ZPQ6NRH', 'B0BGYN4BLD', 'B00P03D4D2', 'B07SHBW7HG', 'B09HVKXPPK', 'B08K898H75', 'B07PKXN9HQ', 'B08X2V5K28', 'B07X51VZGJ', 'B082YTKC47', 'B07PJV3JPR', 'B09Y2H52XT', 'B09Y2K3ZSZ', 'B089P2JB3L', 'B089P347KS', 'B09G3W7MYK', 'B07SMN7FYZ', 'B0BJ18T3BX', 'B0716CJ5RZ', 'B08B5Y8KVW', 'B0B15MK6Y1', 'B086R4D8R2', 'B07FYDGD73', 'B084L41R99', 'B0975BJWV6', 'B08KGTW3CV', 'B084P3KP2R', 'B099NPHMKH', 'B071RMD8JV', 'B08L4Y3HHL', 'B099NQM99M', 'B08KJSGTXV', 'B099NRDQL4', 'B099NRJRG8', 'B08MQRDDYB', 'B09F73C9VK', 'B071DPB1DN', 'B099NNRP72', 'B06Y3JLR11', 'B0B1S2PQ6D', 'B09P4B2HFZ', 'B09F71GZ6X', 'B085PLG1XW']","It appears that the user is interested in purchasing smart devices with Alexa capabilities in the color charcoal, preferably from the brand Amazon. Their price range falls between 18.99 and 52.99. The user seems to prefer items that are compatible with their existing Echo devices, such as the Echo Dot and Echo Show 5."
"['B08LC8WWYP', 'B08LC7H6XR', 'B093DM36VT', 'B08LC8NHF4', 'B08V942LBQ', 'B075MC8FLF', 'B074FT64G6', 'B07KG985HC', 'B093LTVX4M', 'B093LSC81D', 'B098P833X4', 'B093LSPJX7', 'B07KG7W4KJ', 'B08SLY6XCP', 'B08SLZ6S55', 'B09XY4239M', 'B07W53T4B5', 'B08V8CWHNX', 'B08XBF9PDJ', 'B08X9V7XH5', 'B00O2FBJT0', 'B09CFZTL7R', 'B097SQR8Y7', 'B06XSBZLXF', 'B00569HJTU', 'B09D91GPW7', 'B07W54SV4L', 'B07KX1XKN5', 'B06XS6G3XV', 'B08B3R9QXR', 'B09734KFCF', 'B081D4G8HQ', 'B08YF7Q913', 'B07W55XR4X', 'B09DSMD7RB', 'B0B5P2HYYR', 'B07YZNW3MN', 'B08RYDPNWB', 'B07SYKHKQF', 'B07C1WLXHN', 'B0BFKYZGRV', 'B09Q4NVF6X', 'B083KFKHK8', 'B08XB62Y2J', 'B09D9144WS', 'B08XB8Y746', 'B084ZRBBY4', 'B08B88D179', 'B082P4TP9Z', 'B004SBF7IW']","Based on the user's previous purchases of mailing bags, specifically pink plastic polythene bags in various sizes, it appears that their current intent is to purchase more postal bags within a price range of £3.99 to £9.99. They prefer pink colored bags and are interested in brands such as Straame and SurePromise Limited. The user is looking for plastic materials and may be interested in items suitable for greeting cards, A4 sheets, royal mail large letters, clothes, and other office or stationery items."
"['B0189BFVF0', 'B0181BROKI', 'B004FO7A9G', 'B0047VYIJM', 'B08KT7X5JX', 'B00RN2FL7K', 'B0B5RYJQ38', 'B00JJ10XBC', 'B07SMTVLLD', 'B0767D21SN', 'B0723F5PDV', 'B00XKGAI0I', 'B0845RGTL6', 'B00KU69HRQ', 'B07MM4S5WG', 'B0853DLC4H', 'B079DKJ9PB', 'B01MSDX64S', 'B07XJKYJVF', 'B07MSKCDSR', 'B07BCKB1HZ', 'B0BBVZQGX6', 'B01LNU1FA4', 'B07XCYK3HH', 'B0BBQ8RZVZ', 'B0931355RR', 'B0B49H8MSZ', 'B0813SJQ2P', 'B0B4SGJN17', 'B07JGCSBBB', 'B07CN7FD1N', 'B07XRMXRK9', 'B0BFG7HCJB', 'B0B4SG75MR', 'B09H29BM96', 'B0BG5LPN8V', 'B09DSPYGJF', 'B001C43UO6', 'B07C58CVGH', 'B078H57KMF', 'B07T42KRCB', 'B0B4SDC62L', 'B07BV72R4N', 'B0B4SBGF54', 'B07FXJF571', 'B08FDVXC8M', 'B0B4SDH59R', 'B0B4SBJG88', 'B0B4SJ6LFT', 'B08WQBVWGC']","Based on your previous purchases, it seems like you are interested in finding items related to IBS relief, specifically Buscopan IBS Relief products. Your preferred price range is between $4.75 and $7.00, and you have a preference for the brands Buscopan. Your previous models purchased are 100694441 and 3800588. If you are looking for similar items or alternatives, please let me know so I can assist you further."
"['B08LDWFJ7T', 'B089TQ3DWS', 'B09BW2NBGW', 'B09BW3JSR7', 'B078KTN4K3', 'B089TRMFRF', 'B08V4WCW31', 'B09QLHTNNB', 'B08XXLS63M', 'B079H35P8J', 'B00SYSRFBC', 'B07MLY2PXT', 'B00IVJK8Y0', 'B00UCWQMZ8', 'B001W03MBQ', 'B001EBTUW8', 'B079H3MXTJ', 'B096H4G4PG', 'B07NLGCF2W', 'B07P5JFS1C', 'B006GUK5KI', 'B08VNKWVFT', 'B082TSWFV5', 'B001W03MD4', 'B0BLNBJ652', 'B01IN4XHWC', 'B00MYL9JW8', 'B08G46GCHR', 'B09J18D4HY', 'B000TSOO3M', 'B08LDSP7J6', 'B09QLHBWT4', 'B09NP8KTVB', 'B07CGLP1V4', 'B09FNKD67X', 'B083VZW49V', 'B0002HB0HI', 'B096KT564H', 'B077P7M1ZM', 'B0BFX2TT3X', 'B08PG2JC5C', 'B09GB9FYXB', 'B09BW4VNGM', 'B0987SF71C', 'B01AAHX4DC', 'B0B85LC2T6', 'B00T9UR1WM', 'B07KJWNXTJ', 'B09KC2MRTY', 'B09WD527HR']","Based on the user's previous purchases and preferences, it seems like their current intent may be to find educational and development toys for babies and young children. They are likely interested in items that offer learning opportunities through songs, sounds, and interactive features. The user also seems to prefer items in multicolor and other colors, within a price range of £2.5 to £26.73. Popular brands for the user include Kobayashi Healthcare Europe, Ltd. and Fisher-Price, with a preference for models such as 4029203/111, CDG57, and CDG33. Materials like metal and plastic are also preferred."
"['B098B1C912', 'B098B2XJJ6', 'B09N3G5L78', 'B07RLG6DXL', 'B0B4B65C92', 'B0953SCYVD', 'B0953RS8GY', 'B08DHVW3KP', 'B09BBBGD1H', 'B0972QWZ11', 'B0168YH46O', 'B097DBJR7X', 'B00BG5CUMY', 'B08GKP3L51', 'B093QJRDGC', 'B07RMJ8SG6', 'B08PFHW3R5', 'B0972QFFBK', 'B07Y9WTHQP', 'B0972PK65G', 'B08MFBGF8G', 'B07Z19B9NR', 'B081GJY1VX', '0008306532', 'B00FBWBM3G', 'B000HWXG0M', 'B000CFWFYM', 'B08CJBYDYZ', 'B07XP977VD', 'B0824SPBZ9', 'B07RPYRNRM', 'B09FB369NG', 'B08M3DMN4Q', 'B0BC8HRZKH', 'B00426D500', 'B08WKF5HZR', 'B07H5HYW6Z', 'B079R8J8VX', 'B07QC37TX6', 'B07FWHJHTH', 'B08DHL6K6Q', 'B08RZ8RKRB', 'B077NRD2LH', 'B01ARGC2VQ', 'B0871GQSHT', 'B08XY315Z4', 'B00R35ATGA', 'B082XNDPVK', 'B09QQKV9SN', 'B09RMTDYSH']","Based on the user's previous purchases of Skillmatics Card Games, which are engaging and educational games for children aged 4-7, the user is likely interested in purchasing another engaging and educational game within a similar price range of 11.99 - 12.99. The user prefers multicolor items from the brand Grasper Global Private Limited, made of cardboard or paper materials. They may be looking for games that boost observation and logical reasoning skills, offer fun for the whole family, and have elements of action and challenge."
"['B015T6YNBG', 'B079Z1CW3X', 'B08DJ9DZWS', 'B07DWWRZ8F', 'B0B2572DL3', 'B08LZ8XSBY', 'B09JWLC3TC', 'B08CZPL5NX', 'B08F76TJZJ', 'B08D753J6V', 'B07B2T345D', 'B091ZHQF3D', 'B09D7V9D7M', 'B0B6CKTP22', 'B0B46G1LMZ', 'B08GYDSD72', 'B09CZ7QY1P', 'B07GGYWX4D', 'B0892VPTKZ', 'B08DG1MVRH', 'B09DFGDXH6', 'B082STKBXS', 'B09DCN23PN', 'B08GKHHXB7', 'B09L22Z4CF', 'B097RYMPF1', 'B07HZ1FVGC', 'B078N1DBY9', 'B099BZ77L6', 'B07ZFHJCBG', 'B091TY95CS', 'B01MR3OPBA', 'B079YTWQ5T', 'B07XNQCR4L', 'B07XSC5TW4', 'B08F3SQLXB', 'B08K3G9K31', 'B08757HVVV', 'B0BGS1D4B4', 'B00ROSVV7M', 'B0846PMST3', 'B072FKL4XD', 'B0B46NSX2H', 'B08179HMHF', 'B0928S6XYX', 'B09C5BH2XM', 'B09B2HM35L', 'B07HF2TQCY', 'B0B5LWKPJD', 'B0B8CCWM17']","Based on the user's previous purchases of beard growth tools, their intent is likely to continue enhancing their beard growth and grooming routine. They are interested in products from the brands LAVOSSY and uLab, with a preference for items made of titanium in the price range of 11.99 to 14.99. The user might be looking for additional beard grooming tools, such as oils, balms, or other accessories related to beard care and styling."
"['B088ZPL2XS', 'B088YTYSRS', 'B091CL93WY', 'B0BD57LB9X', 'B0082ZZ6NG', 'B079X6FR7R', 'B00KU69HRQ', 'B079X96VBL', 'B01KHILJ5O', 'B07WDW24BH', 'B01N05W6JR', 'B00T9UR1WM', 'B07WGYW2BR', 'B0B8VKDLD8', 'B08XX1BF42', 'B08FY2TBWW', 'B09JK92LRZ', 'B076CJWFZ2', 'B07C9CQ9L5', 'B08ZH97G47', 'B0B2DR1LGR', 'B01JFPA0X2', 'B01MF5W35A', 'B08MKQC6FC', 'B0B465SVCQ', 'B0B48X6NX3', 'B08P3KRD8K', 'B07W57WPTM', 'B08Q3HVRDK', 'B07V9WFY56', 'B09TRJNRVT', 'B07W8MTX7P', 'B09FK3S86M', 'B09GM9RNP2', 'B09996XG3L', 'B08ZCNZ7R2', 'B09292TTF9', 'B019DNTN98', 'B07RL9KXF5', 'B099WTGLSD', 'B09ZV1ZVQB', 'B07WTXJGFX', 'B07XGQLFD7', 'B08KPS4MFM', 'B07W7JJRJQ', 'B07KJGLS9P', 'B07CHZ132F', 'B08FJ81JP2', 'B09SL37QX5', 'B09L5PBRPQ']","Based on the information provided, the user's current intent is to find items that match their interest in grey, wooden, and yellow bedside lamps with wireless charging capabilities, touch control, multiple color modes, and a modern design. They prefer products within the price range of $19.99 to $49.57 and are interested in brands such as COLSUR and Beehero. The user is looking for lamp models S21 and TAD made of materials such as silicone and wood."
"['B082RJWHBR', 'B09TW5W2JP', 'B07XNWYZTF', 'B07Q8FJH5P', 'B01N6SGWBO', 'B09HCJNWJ3', 'B08FD6188Q', 'B08R1ZBHY4', 'B09J52TM8Z', 'B00T9UR1WM', 'B07V9WFY56', 'B002GZCGM2', 'B07JWD931J', 'B08R1ZS7KT', 'B01N05W6JR', 'B09V2M4L8L', 'B08R21S8VT', 'B09NR8WCWF', 'B09HLDMN7J', 'B09MZ8ZHYS', 'B08MKQC6FC', 'B07RL9KXF5', 'B0BCHPR94Y', 'B09G3BB1N3', 'B0BD7Q2WKP', 'B08BL793R1', 'B07XM7YGQ5', 'B07WFB6QMV', 'B089ZPJXWZ', 'B08PHKJPD3', 'B07RX3JWSB', 'B09TPK38VG', 'B09L66HTDP', 'B09DRJNBMV', 'B09CB97B3V', 'B07RD6PV28', 'B00AAT3SVE', 'B09KBHT6MM', 'B0B49Y1RYV', 'B013KK4ENK', 'B08FXDPHPJ', 'B0B156CCS6', 'B07N2HDSB9', 'B093K6ZGW9', 'B09BVDK36H', 'B089Q5QN8F', 'B08BC9HX3Y', 'B09JSQ8ZDV', 'B0BC8Q6J2B', 'B0B7MFRJ8K']","Based on the user's previous purchases of AGPTEK Wireless Chargers in both black and white colors, it seems like they are interested in purchasing another charging accessory in the same price range ($13.99), preferably from the brand AGPTEK. The user is likely interested in items that are compatible with a variety of devices such as iPhones, Samsung Galaxy, and AirPods, and offer fast wireless charging capabilities. It would be beneficial to recommend products that align with these preferences."
"['B09L828H2N', 'B0B4DVGV24', 'B09DPP6MSQ', 'B09ZBXF3LG', 'B07YXNXV2X', 'B07YDNGGYV', 'B0B8RMSH3N', 'B07Z4WHV92', 'B08MFBJM4T', 'B0957YKNKX', 'B002IRKE9A', 'B07DW93NSK', 'B097XKRK93', 'B086W55NRY', 'B08HQRJ7YK', 'B073V5S3J7', 'B07VNX58MW', 'B07YTSL85K', 'B08KJFZFKM', 'B002IRMB7I', 'B07LFRDZCZ', 'B09N45Y5NZ', 'B09SHJLP2V', 'B09FHS2HRC', 'B0B6H7N1MM', 'B07T9DGJVY', 'B09LD61551', 'B09DQ7FQBP', 'B07T1BB479', 'B07RYTSNDV', 'B082881Q14', 'B09YTHGN7D', 'B09PD5C63W', 'B0B9FSXRQ6', 'B01IN1ULMY', 'B0B2MYYJ6M', 'B0B6W1DRYG', 'B09SY2YDLB', 'B097DR7NRG', 'B08M457S6Y', 'B084GX87GK', 'B007MMAPA4', 'B087QGDCXS', 'B084NW3PHT', 'B08NW1XJ55', 'B01MG83TGJ', 'B08NW13MDX', 'B09FPJLHRP', 'B087QF89W5', 'B08M3CP82M']","Based on the user's previous purchases of erasers and a complete back to school stationery set in white and Oxford Blue colors from the brands Ashton and Wright and Helix, it seems like the user is interested in purchasing school or office supplies in those colors within the price range of £2.89 to £27.87. The user prefers items made of plastic. I can suggest items like white and Oxford Blue stationery sets, plastic erasers, or other school supplies that match these criteria."
"['B015J4OZ70', 'B0866KS98Z', 'B015J4POA2', 'B00RXG9VA4', 'B07CMW66HT', 'B086K1Q3QM', 'B06XGLMR1B', 'B09D8DM742', 'B07YSHHNRW', 'B092DHDDXY', 'B0949F5KB5', 'B015J4Q9TM', 'B07BPWH82X', 'B07L8D6XM8', 'B00MULOV8E', 'B09MMF5CSX', 'B09RVDLPD5', 'B09F9BZQDM', 'B01EY4G9FM', 'B01EY4GA1A', 'B07XKRMG5K', 'B0B8JZR8SQ', 'B096425KDD', 'B06WW9NGS5', 'B00R9MG7HW', 'B07B4FNK5F', 'B0852679YQ', 'B0BF1477CK', 'B08FV1KV83', 'B07ZB5C3ZM', 'B0BC4QTCTP', 'B0BHZT22ZZ', 'B01N5I0RQH', 'B09HWCSRSN', 'B07VS2MYRB', 'B07KDFTF2Z', 'B07GXMQBNT', 'B0B4CWPDVZ', 'B0874P2NS3', 'B06X97WBT8', 'B07FGCW51M', 'B01ET7KVZI', 'B0BHRFZ846', 'B09D8T4NJR', 'B00498YIHU', 'B015J4PRTU', 'B015J4Q6H2', 'B08ZSSX34S', 'B0751MHDRC', 'B01M8KV6XU']","Based on the user's previous purchases of Galaxy Ripple Bars Multipack, Galaxy Ripple Chocolate Bars, and Maltesers Chocolate Gifts Box, it seems like they are interested in purchasing more chocolate gifts and treats. They have a preference for Galaxy and Maltesers brands and are looking for items in a price range of £1.35 to £44.95.

It appears that the user is looking for chocolate gift items that come in multipack or sharing pack sizes. They may be interested in exploring more options for chocolate bars or gift boxes from these brands.

Considering the user's preferences, you can recommend chocolate gift items from Galaxy and Maltesers that fall within the specified price range and are suitable for gifting or sharing."
"['B08YGQJF4L', 'B000KVN6O6', 'B09DCBD1WG', 'B0BJ7H3DR9', 'B09DC9WSXL', 'B0874XZ765', 'B09L64G7JJ', 'B09X1SL6LR', 'B09954YTPX', 'B07VD91NBT', 'B0B6DD3GW5', 'B0BL16KCM2', 'B08HKP4FFT', 'B08LPG13BD', 'B08HHNPTKS', 'B08HKPXCT9', 'B08KWN4652', 'B08NXYBG1W', 'B0B6D9MQ69', 'B0000ZQT1O', 'B08K3SXD6N', 'B082P461RH', 'B09J8FY25T', 'B09DC7ST2S', 'B09L63V8Q7', 'B089SX2S15', 'B09NZQXHN1', 'B07ZTQ4TRV', 'B09LCXL3S2', 'B098R3T159', 'B008M721MS', 'B07MXLPLCR', 'B0B6DB74X7', 'B0963ZK1WD', 'B0771HD7R2', 'B09L8PRHCJ', 'B08JDQYCRS', 'B09QCQRQ8Y', 'B08HL9DGPN', 'B09DL7KY4K', 'B0187FY2AI', 'B08CZZQHXD', 'B089GR4R3M', 'B07YN1SL9B', 'B0049JQJMG', 'B09SYM4D6L', 'B00GT5887C', 'B07796YKR4', 'B09J57WYJV', 'B09BBCF6X3']","Based on the user's previous purchases of Original Sky+ HD remote and Original Sky Q Remote Control, it seems like they are interested in purchasing a new remote control for their Sky+ HD or Sky Q digibox. They prefer the color silver and are specifically looking for remotes from the SKY or Sky brand. The price range they are comfortable with is between 19.99 and 20.9. The remotes should be made of plastic material, similar to their previous purchases."
