top_k_predictions,user_intent
"['B010SMBJPO', 'B001G4F6H6', 'B01N457SMS', 'B015Q8BMM0', 'B00FYSHYQ6', 'B01MT0WT6B', 'B017WI04PS', 'B018463ZIK', 'B001RYUCHY', 'B079XLD7D5', 'B07L5SHQZQ', 'B079XP7T5H', 'B00823938W', 'B01N7DNNKW', 'B00792C4ZG', 'B0030G7LKI', 'B01N3XOXW9', 'B07G8FHXDL', 'B00LZW74F6', 'B097HQK19B', 'B0B1JLRRYM', 'B00CJAM12E', 'B015T5C1VG', 'B09MQXXKKL', 'B009P4P6NS', 'B01DY5JFQW', 'B001RYOPAE', 'B0851PR41K', 'B003Y7HHAM', 'B08FTKJ232', 'B009694U3E', 'B0030U3G5I', 'B01BTKTU2S', 'B005GRGARE', 'B08KYMTHFC', 'B0899CTT56', 'B079H3M5MR', 'B00TZ8LGGU', 'B0052FZ35A', 'B09LSGBH4T', 'B0B2LLWSLV', 'B08FBRZZ6W', 'B09MR86V6K', 'B01I5L1UNG', 'B00UI5EFYO', 'B0B2LQ5R4K', 'B00PSKQH18', 'B0842Q65GQ', 'B08JQHKKRV', 'B00469YJT4']","Based on the provided information, the user's current intent seems to be related to purchasing hygiene products for cleaning purposes. They have previously bought Milton Sterilising Tablets used for cleaning various items like bird and animal cages, food, and drinking bowls. The user seems to prefer white-colored products within a specific price range. They are specifically interested in the brand Milton and the model 5010527585169.

For their next interest, you could recommend other cleaning products from the Milton brand that match the user's preferences, such as Milton Sterilising Fluid or Milton Antibacterial Surface Wipes."
"['B00FEE92FQ', 'B0B9TB2W65', 'B09W6KRR37', 'B0949WTZRF', 'B08L44J65R', 'B071LPD8KF', 'B07XHNR5DJ', 'B000LNG1RW', 'B01KXOLGAA', 'B01BYG1ITU', 'B00FEE1DLM', 'B01EI1MUZY', 'B0B4MXC22T', 'B0926G863F', 'B09B4JHF3H', 'B09B4JN7W8', 'B006A40SDY', 'B07L3MT7CZ', 'B07BP9THZJ', 'B06ZXX84Z7', 'B07M743TG8', 'B01I5L1UNG', 'B0BCL22LLS', 'B07S6JQWP7', 'B01HXX4FF2', 'B001RYUD5U', 'B06W57WHQ3', 'B096W22NPM', 'B07CC1F9B8', 'B00469YJT4', 'B01BVZAQLK', 'B0926KCST1', 'B01A3RM2SM', 'B00VG0KBJI', 'B08Q35FLVX', 'B0BK8GBGRB', 'B07PMKCF34', 'B08RZC3P6Y', 'B087TP9X3S', 'B005JJ8SI8', 'B01AASU696', 'B0941LG78D', 'B09VWFCLLD', 'B074MX955V', 'B08C1YX4JB', 'B09QD54JCY', 'B09MQXXKKL', 'B00G3JNU8Q', 'B016IKXVD8', 'B07HWMSJV3']","Based on the user's previous purchases of intimate washes, wipes, and creams from the brand Vagisil in white packaging with a price range of $2.99 to $7.79, their current intent is likely to be looking for another Vagisil product related to intimate care, such as a new wash, wipes, or cream within the same price range.

I would recommend suggesting Vagisil products like new variations of intimate washes or wipes that provide soothing, sensitive, or hydrating benefits to meet the user's needs."
"['B0017RPIKM', 'B00I4UW0E2', 'B07CRP3H6C', 'B005345JFY', 'B0052CV5GO', 'B07118YPKZ', 'B00H0CUK8I', 'B08ZSH6KFD', 'B07Z3NPLTQ', 'B081K48MD6', 'B08KWCMTHD', 'B082DG8D7N', 'B08KWS5W14', 'B003ZIRCIC', 'B07P9MM12S', 'B08NPLPCZJ', 'B08KWC1PKJ', 'B01AS7OTAG', 'B0017RPIKC', 'B08HHT87LT', 'B08NPSQN2M', 'B08KWFBSVM', 'B08NPTTVD8', 'B07XJ48TP1', 'B08Z8M5X81', 'B08NPR3N5P', 'B08NPT1NTR', 'B079Q33CNZ', 'B089YP9G2H', 'B06W2JSP7J', 'B08NPP4KF3', 'B078SC779Y', 'B075QP4T9G', 'B0B12C7TLD', 'B0B12LKNGB', 'B08MNJC11W', 'B08KWF84ZQ', 'B08NPD8N9M', 'B07HFL8VHV', 'B0B1Z5CXNT', 'B07HFKHYCM', 'B08VWBMF28', 'B07HFK99KV', 'B08KWH9YFT', 'B07HFKVXYZ', 'B01DY6N350', 'B07HFJB95M', 'B07PCN35K9', 'B076D9QT7F', 'B07HFJHD11']","Based on the user's previous purchases of moisture absorber traps and crystals from the brand Kontrol, their intent might be to continue managing indoor humidity levels and combating dampness. They are likely looking for similar products in white color within the price range of $11.9 to $45.37. It could be helpful to suggest more Kontrol moisture control products or related items to meet their needs."
"['B095C2B19V', 'B083ZL56JQ', 'B09Y9565DN', 'B09TXP63D4', 'B09HHN4QTQ', 'B0842B1XMR', 'B0B2V3MWP6', 'B0BHHQ75PX', 'B0B4WS5WGN', 'B09J4Q4F67', 'B0BLCMD1CX', 'B0B5ZYL2M7', 'B0BD7TJKZP', 'B09SFNMJPT', 'B0BGZNXRHQ', 'B0B92KW3MY', 'B0BKPTPJZB', 'B08L1625DZ', 'B0BD7ZWRTS', 'B0BFVPQVVC', 'B07PQBY6YB', 'B0BG1K8BB6', 'B0BGHGVKN5', 'B0B8VJZN32', 'B09BNFPQYW', 'B001E5CEZY', 'B0B8VM31TQ', 'B08M782BDH', 'B09WY4GR5P', 'B0B7WRF3GB', 'B07G4GYM5K', 'B0B68P73JV', 'B08P8GF5Q7', 'B09QYP3KL1', 'B0BB5XSZHW', 'B08SJQRWY1', 'B09QYNYB9G', 'B08BHTXYCY', 'B0BJD22M5Y', 'B0185V3WHI', 'B0BH3VY7JZ', 'B000SOJXGA', 'B09WJNPCY6', 'B0BD1YMR8H', 'B0B8DXJXNH', 'B08LKZ6VDK', 'B081SYJ7RL', 'B07DWF91P7', 'B0BD81MZPM', 'B08J2TZVTT']","Based on the attributes provided, the user's current intent is to find ear care products within the price range of $3.99 to $5.99, from brands such as Earmedic and Medi Grade. They prefer items in blue or blue-white colors and made of silicone material. The user is likely interested in ear wax removal kits, ear cleaners, ear drops, and other products related to maintaining ear hygiene and health."
"['B09LMF4P1R', 'B0BKTD2RJ9', 'B0BKTBH3CM', 'B07BR4VNTY', 'B075NPKW3C', 'B0BHZ17KF6', 'B09HKKYH9R', 'B09FM3JMK2', 'B08K5FV88H', 'B09JMF38XR', 'B09J2X6T66', 'B0BHZ1LQZP', 'B07GXMQBNT', 'B0BKST6JYL', 'B09GTT9PKN', 'B08KLS2N83', 'B09GMY33F6', 'B09M7DRNL9', 'B09ZHVVMV7', 'B075KKZRC4', 'B0BHXRJYNQ', 'B07ZRHSBLK', 'B0BJ5HNYN9', 'B09JBGRG3X', 'B0BBRJ9RDW', 'B0BGT1CS1G', 'B0BGCTHP5Z', 'B0BJ4XPSN6', 'B09M455K4R', 'B07XKQK4QB', 'B09KHLLLCN', 'B08MXBHPBB', 'B0776TV6KZ', 'B0BHWWGF9H', 'B0BJ9GG6XC', 'B082VW7866', 'B076J9CKLT', 'B09HXPSBZH', 'B0BJJD7DT7', 'B0BJF95PX1', 'B08L6VM3GR', 'B09JKL7BNH', 'B0BGSN56VQ', 'B0BD97JL1G', 'B076CSKJTG', 'B09KCKZJJ6', 'B07ZCN2HGX', 'B09JGS56M3', 'B09HXZ2XL7', 'B09BNFSYFZ']","Based on the user's previous purchases of Kinder Bueno Advent Calendar, Kinder Chocolate Advent Calendar, and Kinder Chocolate Advent Calendar House, along with the preferred colors, brands, and model mentioned, it appears that the user is interested in purchasing festive chocolate-related items within the price range of 4.99 - 8.96. Consider recommending more chocolate advent calendars or holiday-themed chocolate gifts from brands like Ferrero and Kinder that fall within the specified price range and match the user's previous preferences."
"['B09QLXNPCK', 'B095C6GZL3', 'B095C32BY2', 'B0B2J4W5MB', 'B09P88Z7B9', 'B09QLW34CF', 'B09XD6KNZ9', 'B09WKBX44K', 'B09C5C7VDQ', 'B0B6ZSKSS1', 'B09C5CRJ34', 'B09C5BMWM4', 'B0BDGJPP32', 'B0BHW8LLCW', 'B096LWRQBW', 'B0BHW7K34X', 'B096LWQV6T', 'B0B38QMHY5', 'B0B28M1HX9', 'B0BDGMT7DP', 'B086K8GQ29', 'B0965SCKK5', 'B09YCXP4RZ', 'B09P88HYZG', 'B08D32T59X', 'B09YCDP1YY', 'B09CKJ4Z15', 'B08JB383VW', 'B09GJX5B59', 'B09BTCVTDB', 'B08D3JG57S', 'B08LDQRHZR', 'B09CKGXND5', 'B0B3LJQMPM', 'B0BDH3V35N', 'B09YG52K3X', 'B09XHJM71H', 'B081PVSCW9', 'B08M36GH6G', 'B07921NQVH', 'B09M725QCT', 'B092MDVM4S', 'B0B158W1DF', 'B07Y3T2XXV', 'B08NFRHP7S', 'B00T9UR1WM', 'B0B3M2B3L3', 'B00KLEDOIA', 'B07MFNRZ26', 'B00CPQJFFS']","Based on the user's previous purchases and preferences, it seems that they are likely interested in purchasing another tablet with similar attributes such as a 7-inch display, Android 5.0, quad-core processor, dual cameras, capacitive touch screen, Bluetooth, and WiFi. The user prefers tablets in black, rose, blue, azure, or pink colors within the price range of $47.99 to $59.99. The user has shown interest in brands like Haehne and Amazon. Therefore, they may be looking for a tablet that falls within these criteria for their next purchase."
"['B006US6ZLY', 'B013XC64J2', 'B013XCC3TW', 'B01A95KS4S', 'B00KRDGCKM', 'B07DLLL278', 'B003UYTLY4', 'B095NX64S1', 'B0B1BMY9FS', 'B00A1KV52Q', 'B0001OZIFW', 'B079N4BZS3', 'B096ZMX1RB', 'B08R79BJBP', 'B08P73JWRL', 'B0853F2BNK', 'B08KQFYH1Y', 'B000TAUOJ8', 'B000I5SCB6', 'B091CXLTGH', 'B09LVHX48V', 'B07N1H3MGW', 'B09QLCMG2V', 'B00CQQH6R6', 'B094QVBNMR', 'B0018ACLWQ', 'B0895Z5S1Z', 'B0001OZI48', 'B08P755SN2', 'B0193ZIR20', 'B0BHRD1MC5', 'B09WRGTY5C', 'B08QN51WRX', 'B000NLZBGY', 'B017M7B6JC', 'B0853DFQVV', 'B003OW62LC', 'B01B8CL3VI', 'B08KGTQTXP', 'B0074HOKB2', 'B0BFPHTGHY', 'B0BBTXLDPX', 'B0B9SY1QCW', 'B07C5LMLSV', 'B0084M67P8', 'B07TXT5NPF', 'B09KSZ7YBW', 'B096ZP75VY', 'B00DEQUB0Q', 'B074169MSZ']","Based on the user's previous purchases of UniBond heavy-duty clear glue and mounting adhesives, along with their preference for clear and white colors, as well as the specific brands and models they have bought (Henkel 1963625), it seems like the user is likely interested in purchasing more adhesive products in the price range of 4.0 - 8.99. The user may be looking for similar strong instant grab adhesives for DIY, mounting, and repair jobs, specifically designed for interior use. Based on their past preferences, they may be interested in exploring additional adhesive options within the given price range that match their desired color and brand specifications."
"['B09FYGY1PT', 'B07WW7KWYD', 'B095LXW1TF', 'B09699GQ6X', 'B095LYK6NQ', 'B095LXBYX3', 'B091B28SWF', 'B09TB3WC9Q', 'B09M9JDSKZ', 'B096991YFM', 'B09FPXLJRR', 'B09FPXFFM9', 'B09TB3LZFC', 'B08TQXZHSZ', 'B08JQCL52L', 'B07WHTS6XM', 'B0BD56YFRP', 'B09TB3YT3C', 'B09FPY4N74', 'B09M9HQXSV', 'B08K94CQNS', 'B08TR1BKRQ', 'B08R3KXM8H', 'B07Z61GN44', 'B07WDL243H', 'B0876GCXGP', 'B08X1TX7QZ', 'B07Z63M8BW', 'B09T9QJNCW', 'B0876FXKXC', 'B01DACFHXO', 'B01DACFHUW', 'B0921BD9DB', 'B09MFB9RQJ', 'B0876GZ44N', 'B0876GPZ8G', 'B08MNQX33P', 'B0BDR6FVXC', 'B0921M8RMW', 'B091FPQ8M9', 'B0876FVNM4', 'B0BDR69RYX', 'B0876FZZM6', 'B09W2BYHZ6', 'B0B7GCMZPN', 'B091FNQGQN', 'B09SWHQZKC', 'B091FPHJJS', 'B0921K7ZRM', 'B08BRVBX55']","Based on the user's previous purchases and preferences, it seems like they are interested in purchasing a new phone case for their iPhone 14/iPhone 13 model. They prefer cases that are in black or clear colors, made of materials like polycarbonate and polyethylene terephthalate, and fall within the price range of 7.99 - 15.95. They have shown interest in brands like iCatchy and CASEKOO that offer shockproof and slim-fit cases with anti-scratch and anti-fingerprint features. It would be beneficial to recommend similar phone cases that align with these criteria to match their current intent."
"['B0002HB0HI', 'B000067R86', 'B00MYL9JW8', 'B07W3RSC1J', 'B0B639F5QP', 'B09NP8KTVB', 'B085QDMPXT', 'B093ZLPC6D', 'B08ZK8P99H', 'B07NST6D1B', 'B07RW3X2XC', 'B07X2TZ1SK', 'B07XDZ1M9C', 'B082YW6THW', 'B08LDW6VX8', 'B0B2PN9HQ4', 'B00T9UR1WM', 'B083W12617', 'B085Q49XPP', 'B0BFP8VBQY', 'B0BCZ7PFL7', 'B089TRMFRF', 'B082YVQPFS', 'B07X5M5BVZ', 'B077P7M1ZM', 'B08V79DWRK', 'B08G46GCHR', 'B096X66D1B', 'B0856SSDPJ', 'B001W03MBQ', 'B08FXBJT14', 'B086VDNMCW', 'B08X25RJQB', 'B07C45JS8P', 'B07P5JFS1C', 'B07RHLKTKS', 'B07Q22QS67', 'B00IVJK8Y0', 'B07QXQQKRY', 'B07N8MW22Q', 'B00FRHCA7C', 'B0B5TH34LN', 'B07NJJ8TBN', 'B07XRMXRK9', 'B08WXNHKCR', 'B07DMW9M6S', 'B08GD18JFN', 'B09TR53PX1', 'B01BFGBU56', 'B07N1JNS4V']","Based on the user's previous purchases and preferences, it seems they are currently interested in purchasing toddler cutlery sets in blue or grey colors within the price range of $5.49 to $9.99. The preferred brands are Lehoo Castle and Munchkin, and the materials they are looking for include stainless steel and plastic. They may be interested in items that match these criteria for their next purchase."
"['B01N0OM1JK', 'B01A3RM2SM', 'B07Q5WB9BD', 'B07MTK91YF', 'B0B9NRFGMM', 'B099RYBS8P', 'B08W2DFL2Y', 'B099L3BRVX', 'B08KXXXS9G', 'B08DCZ5XG4', 'B08721P4Z4', 'B07JJ7J4WL', 'B07KWLR3QS', 'B07R94MSNV', 'B01IDHWSS8', 'B01M6ACSCW', 'B01IDHX6DY', 'B09VQZHGM9', 'B08GK1BN9M', 'B0752RLDXC', 'B09HT7LKZP', 'B07BKFCH8H', 'B08R9H96YY', 'B071S61W1C', 'B073X2RVGS', 'B0B5F9SSDJ', 'B09HG34VL4', 'B08XYBYT2Z', 'B09FB6HTWB', 'B08X7CRCLH', 'B09FT82HQM', 'B0B6RQS2LY', 'B08698T1DL', 'B09HFQX16S', 'B001TK4LM8', 'B082HTV7NY', 'B01LZQCD0I', 'B08698S5W9', 'B0749P9V7G', 'B09HFN9W9Q', 'B08X7FGHG6', 'B00FLYV01S', 'B09HR26SWF', 'B09HFN37MZ', 'B01N1LL62W', 'B07PKTR9QF', 'B09Q95XJ6Z', 'B07XJKYJVF', 'B00W3K3C8W', 'B0BFF1DB2C']","Based on the user's previous purchases and preferences, their current intent seems to be focused on purchasing everyday household and personal care items like paper, coconut oil, body mist fragrance, toothpaste, all in the price range of £2.99 to £14.45. They prefer brands such as Indigo, Coco Road, Incos Ltd, and products in white color. They seem to be interested in products that are organic, fair trade, and suitable for everyday use."
"['B081YVPK3P', 'B07FPZVBZF', 'B07FPMDN9Q', 'B081YV8YPX', 'B0756M4NMR', 'B08SNJ6RBG', 'B08C63VJJZ', 'B08PDZ8G58', 'B086T2QJJV', 'B07B8WG1CB', 'B08PDTJ6X6', 'B092DB47K8', 'B08L75XNXP', 'B07B8X7XY9', 'B08L75PF9N', 'B09J19TM9J', 'B092VRZD84', 'B07J4RH1TV', 'B08QN98JYQ', 'B07B8VMV3N', 'B07FPMC875', 'B06XBQLDKQ', 'B0092P1H74', 'B07WCXB1B4', 'B08Q2DXTKB', 'B01E8VMXNI', 'B086T1ZMPW', 'B091LJV3YQ', 'B086X8LC3D', 'B08SNLMD5S', 'B08R1SB6SG', 'B08L7581SJ', 'B09JL1KM65', 'B0BJQKTYDS', 'B08L76G2TT', 'B07VN2F3TC', 'B08P4LT27Z', 'B09BDBM4LY', 'B079TP1P3V', 'B08L76C221', 'B07KZ671CQ', 'B082875TGN', 'B00NTAOMPM', 'B08L75XP6Q', 'B08L74PTCR', 'B07VSCDGC2', 'B07GR9YY6X', 'B082SZTHJL', 'B091LGC2RY', 'B09BR5HQB2']","Based on your previous purchases, preferences, and price range, it seems like your current intent is to find more vegan protein powders in chocolate flavors from the brand PhD Nutrition within the price range of £12.99 to £17.99."
"['B09Y8BBG5D', 'B0B75QGM49', 'B0BFP88WCV', 'B0B787PQ19', 'B0BFPBC1TP', 'B0B75N98M7', 'B0BFPBZS1G', 'B0B7JLNBB9', 'B0BFP7FZ8T', 'B0BFP6624L', 'B0B7876KC2', 'B0B4K63SMM', 'B0B7KFRL2M', 'B0BFP6F4YV', 'B09T2G2RPM', 'B0BFPDPSWD', 'B0BG3F6LKG', 'B0BG3GRGW2', 'B0B2X4CFN9', 'B0BG3CPJQL', 'B0B4K725Q4', 'B0B2DZYG9V', 'B09ZKRTYHT', 'B09X3F8KP1', 'B0B4K5YF6M', 'B0B219ZV9Y', 'B0BFP93XY5', 'B0BFP9H6KQ', 'B09PZ38F62', 'B0B784RC4N', 'B09ZKLCKJV', 'B0BFP8V86T', 'B0B21F5ZQB', 'B09TZPH15C', 'B0B1416NBR', 'B0B94183JW', 'B09ZKLCRMT', 'B0BFP8KF1Y', 'B09XVL2XCH', 'B0B8L1HLY4', 'B0BFPBBHYJ', 'B0BJVV5QSH', 'B0B14F6TW7', 'B09J5BSWSC', 'B083JXBH98', 'B0BJVVQGCV', 'B09Y19Z7R8', 'B06WD38JTM', 'B0B6JNVWM8', 'B08PS2F9RD']","Based on your previous purchase of the Pokémon TCG: GO Collection featuring Alolan Exeggutor, it seems you are a fan of collecting Pokémon trading cards. Your preferred colors are multicolor, and you are interested in items related to the Pokémon brand. You prefer items made of paper and are looking for products in the price range of $21.50. Your intent seems to be finding more Pokémon trading card products similar to your previous purchase."
"['B07MRVFZJ2', 'B005A4VXSE', 'B00R35ATGA', 'B0983V3DMH', 'B09S3Z51VX', 'B09S3ZX32K', '0008507708', 'B09B2B5V5G', 'B01BKBXQ58', 'B08XKF6MQX', 'B004FBMV5W', 'B07P1317FZ', 'B09FB369NG', 'B06XYLL66Y', 'B09QCWSDC9', 'B077BG1ZP1', 'B0B88C7B6X', 'B07F1GXSS4', 'B096W2XGHM', 'B09XQYMBQ8', 'B09L1KX3RM', 'B08TPGT1QL', 'B08M3DMN4Q', 'B08CJBYDYZ', 'B07D2HY64Z', 'B00PPWG3OU', 'B09LD29Z1D', 'B01MR9CWIS', 'B09Q99PT2V', 'B094V6V5R8', 'B0792CYMC2', 'B08GSTY877', 'B096MS143K', 'B07Z19B9NR', 'B07SDTK5PP', 'B08XC5LFTG', 'B00V91HKI4', 'B08JKYR39Z', 'B00YTYV8YA', 'B000ES3LOK', 'B0824SNHNQ', 'B01N4MXCK4', 'B0BLKK4RLX', 'B08DHTP6HM', 'B09TD95TRS', 'B01J3KRZ8C', 'B06XHMDVRH', 'B07BZ36NYJ', 'B0BGKWM7H8', 'B07YMR93QW']","Based on the user's previous purchases and preferences, it seems like they are interested in family-friendly board games that involve strategy, mystery, bluffing, and trivia. They prefer multicolor, red, or black-colored games within the price range of 8.49 to 24.69. Brands like Big Potato, Ginger Fox, and Gibsons seem to be popular with them. They have also shown interest in games with variable gameplay, endless replayability, and unique tasks provided by the game. They enjoy fast-paced, engaging games that offer entertainment for both kids and adults."
"['B003ANKZ4K', 'B002CZPR40', 'B002CZPR0Y', 'B0BC85XBK8', 'B0B7HZ1HH4', 'B085XFLJ5H', 'B005XVISYQ', 'B08VGD3MFC', 'B08LGXYPSW', 'B09PFCK24K', 'B09V7FYZ76', 'B0BF11N3X4', 'B08JFT8KVP', 'B00IT2JRE6', 'B08LGZD1R4', 'B07TVF82RL', 'B07B7PRKMN', 'B00V88B106', 'B09KXLP2VD', 'B09FS5ZDMB', 'B09QQR4W6K', 'B0B5Y2CQ79', 'B09CZ8LKP1', 'B09FX65W2C', 'B07ST35348', 'B09B79CFVJ', 'B00MLQ2MUC', 'B09T3WWMGH', 'B085LMZVRP', 'B0825TFFYH', 'B09FG7FK3D', 'B072C1N3FY', 'B09CZ8Z4LK', 'B07VMPFK7G', 'B09FS5H8BD', 'B09KV5RBVY', 'B097MYZZQM', 'B08DNLBJQR', 'B093GGK8SK', 'B09L4BXZKW', 'B08SBRD6S9', 'B0B6GS52ZM', 'B09CZBNTS2', 'B01M7UTQTF', 'B09HSNTJWV', 'B08FM48TYF', 'B096KMKWPL', 'B07YYZ1FHX', 'B0B4NSMBNG', 'B09CKSSXVG']","Based on the information provided, the user's current intent is to find items that match the following criteria:

- Items related to jewelry making kits, DIY arts and crafts, and gifts for girls aged 8-12 and teenage girls.
- Items with a rainbow upgrade or in the color purple.
- Price range between $11.99 and $15.99.
- Brands of interest include BIIB and Aisszhao.
- Materials preferred are Glass, Silver, Metal, Alloy, Crystal, and Silver."
"['B0BHDD4YVW', 'B0BC17CLR3', 'B09FLT9KL3', 'B0BGBRSKWM', 'B09GPTKLTC', 'B08YNBP7RT', 'B0BFD63DPZ', 'B0BCJWCQT4', 'B09G3JPTJQ', 'B0BDLN1NNC', 'B0BHZ89H16', 'B09DCKS3LJ', 'B09LH6RPS4', 'B0BC989FY7', 'B09B1R8JRW', 'B0B8864YRT', 'B0B59136G4', 'B09C5CBP2N', 'B08H5QXTYF', 'B09CL8XNR7', 'B09KM3JXCZ', 'B0BF9WW272', 'B0BKLRKBWL', 'B09FM3JMK2', 'B0BGHLZ7L3', 'B09CYHL2PR', 'B0B84Z425H', 'B0B6PH4S3Z', 'B09B1FNPZY', 'B09FFLXSR5', 'B0B8SMKY9R', 'B0BFL3JV5B', 'B0BC18DJ4J', 'B0B6VK1BPG', 'B0B1PRJNBN', 'B0B4ZFJ1R8', 'B0BG56N1H7', 'B0B4Z6ZKRY', 'B0BG82YZHX', 'B0BG598644', 'B09WN1D2YK', 'B0BG588KR9', 'B0B889Z2R8', 'B0B95ZM24X', 'B0B889J6QL', '1838547444', 'B08QW43S2L', 'B098L2G3RT', 'B0B1JHG2BH', 'B09NPDPFCY']","Based on the user's previous purchases and preferences, it seems like their current intent is to find another advent calendar for a gift. The user is likely interested in advent calendars with themes related to cars, dinosaurs, or unicorns, suitable for boys or girls, within the price range of $17.99 to $18.99. They have a preference for items from the brand iZoeL and materials such as plastic and paper."
"['B000H5V2VE', 'B08WZN7CPN', 'B0BFP81V4T', 'B00OTW0IHU', 'B0B15MQ3HD', 'B07NQM6C6M', 'B07CGSYJ91', 'B086VK5Y7Z', 'B00K6INQNY', 'B018T59VIE', 'B07JYLBZV9', 'B09N323PFT', 'B097K5PVS9', 'B07PGW3L2S', 'B0BFBL8R1B', 'B07PKTR9QF', '1788241010', 'B097K7GFHD', 'B08WZ2ZHJK', 'B097K66P2F', 'B09LTFYZBK', 'B07CQL329S', 'B07Q22QS67', 'B0B291L357', 'B001TJXI6Y', 'B01H2TG4RE', 'B07KWXFF88', 'B09BKB4MHJ', 'B0B6RQS2LY', 'B09HN1S6TY', 'B07VNQ6VNV', 'B006CYZGT8', 'B00V88B106', 'B0792ZB5TN', 'B08CLQCRLP', 'B086VK1H4X', 'B01CYOYOVA', 'B08TBGY2TQ', 'B09KT5QV4J', 'B09PHBSS68', '185128639X', 'B000UEAKC4', 'B018QE4SMC', 'B08FGKQSSS', 'B0063G6MOS', 'B01248YO8E', 'B0BD4K246G', 'B07G4DY8XF', 'B0759S8SZJ', 'B08KR8JZV5']","Based on the user's previous purchases, preferred colors, brands, models, and materials, it seems like the user is interested in L.O.L. Surprise! products, specifically items related to arts and crafts, collectibles, and playsets. They are likely looking for toys and activities that provide entertainment and creativity for children, especially girls. The user may also be interested in products with pink coloring and made of materials such as felt. The user's price range is quite wide, allowing for a variety of potential purchase options within the specified range."
"['B0BH5499RJ', 'B0BH53RCN1', 'B008DCS2A2', 'B008DE75SA', 'B0084D0S8E', 'B0083GDEJM', 'B01BLRO402', 'B0084D271U', 'B01BLRK4V0', 'B01FLY2H0A', 'B09QMK272N', 'B00TOM2SMS', 'B07MS7Q5D2', 'B01FJYDND2', 'B01FLY2GYM', 'B01FJYDNDW', 'B07LF7ZKCT', 'B07MQF9CV2', 'B01N10A1I2', 'B01N9R257L', 'B010ZZ87ZY', 'B083YHLHN6', 'B084TJC9QW', 'B00TOM2SSM', 'B004MLD9EW', 'B005GL52GK', 'B00501J1WM', 'B087X9LZ3F', 'B00TRCL5LU', 'B07HDD44PQ', 'B07HDC68HM', 'B005LUU0KY', 'B009GEFTXY', 'B07HDCMYJT', 'B003M6D600', 'B00GC2NUCA', 'B073ZGQBGS', 'B07GSV4Z6F', 'B07GSWDS6W', 'B00FF8VFC4', 'B09FM3RNWW', 'B09FFJQQ8N', 'B09FM4HMBD', 'B07ZQSQ9LH', 'B082VDZH5H', 'B07ZQRL2H2', 'B07JVGV7GK', 'B07N1QSPLR', 'B07J9LTG58', 'B09CKPCY8G']","Based on your previous purchases of Viking costumes for kids in specific age ranges and different colors, as well as considering the brands, models, and materials you prefer, it seems like you are intent on buying another costume for a child in the age range of 4-6 or 10-12 years, in brown or multi-colored, made of synthetic material, and possibly from the brand Vynche or Christy's within the price range of $21.99."
"['1441313176', '0008419124', '000847902X', '0241433606', '0008419116', 'B0BF2WX9NF', 'B00AD2I50W', 'B01M2URWPH', 'B0819KSQNM', 'B09M5B6N77', '1739719522', 'B07CGSYJ91', '1409520447', 'B0B15MQ3HD', 'B00N4UBNN6', '1912155249', '1912155230', 'B094WYDB6W', '1912155079', 'B07QNYPPTJ', 'B07NJKH2NR', 'B09LGQRFB9', '1529074703', 'B0BJ6X2W7X', 'B09DN1FKN1', 'B0BJ6X5TKG', 'B0BJ6X99TG', 'B0BJ6VPFYG', 'B08XMM17GV', 'B0BJ6VQ3QD', '0751584258', 'B08X6MP3M5', '0751584223', '1405292520', 'B0B31LDVH8', 'B0BCNRBQW6', 'B09BW5M91L', '1787415392', 'B08Z8BMZYT', 'B0BJ54PZV6', '173997123X', 'B07RTPDTC4', '0008546282', '1670971503', 'B0BG2PQMQ3', 'B0B1PFN8HH', 'B0BCZ7PFL7', 'B0881ZB73P', '1407186922', 'B09L7SNBL3']","Based on the user's previous purchases of art activity books by Rob Biddulph from HarperCollinsChildren'sBooks, the user's current intent is likely to be to explore more similar art-related books or products, possibly with a festive or creative theme. The user is looking for items within the price range of $5.99 and is interested in books from HarperCollinsChildren'sBooks."
"['B08Z3F9N1S', 'B09YTQVG18', 'B09VY32YYF', 'B09TSMQ75Q', 'B09XVBNDCP', 'B08LDMVTMF', 'B08Y8GWRW2', 'B09XV8VDFY', 'B09QW4527C', 'B000LWEO7M', 'B096WYD6M7', 'B08TZT9SBJ', 'B096FTQ6YY', 'B08LD2QZ63', 'B07WVRKFR4', 'B007O7AZBG', 'B09B1QMGXD', 'B07W6M92LV', 'B08MDR1DBR', 'B091CFJ4VH', 'B08MDVGN7S', 'B097SFRZ7Z', 'B07XFQJH76', 'B09B7N1CKQ', 'B099F46Q16', 'B09727ZXZZ', 'B08CCY4ZMN', 'B08ZSCXR1R', 'B07ZGJ4PDF', 'B08W67R8RQ', 'B092MLXPWZ', 'B09PR4YDQ2', 'B092D5JDJ2', 'B0957139HX', 'B07QC5GBHG', 'B09JC9DNQL', 'B07N1RHKD7', 'B07ZJGS9W9', 'B07B1J4B57', 'B0924LW1ZZ', 'B0999S258T', 'B08N65X9W2', 'B077ZM2QKC', 'B08DCZ5XG4', 'B08CCWPNV7', 'B08JSMR854', 'B096NWC9GC', 'B01M6ACSCW', 'B073PVVNP4', 'B08HV4M9YV']","Based on the attributes provided, the user's current intent seems to be focused on purchasing facial cleansing brushes in the colors blackgray and rose, within the price range of $11.99. They are interested in brands like Fashion Base and prefer models made of silicone. The user is likely looking for similar facial cleansing devices that match their previous purchases in terms of features and specifications."
"['B09BW11P7F', 'B09BW3DJMF', 'B0B59GRB6J', 'B09DN1FKXV', 'B09BW1Y677', 'B08B1676TZ', 'B0B59FWK87', 'B09BW3DXWB', 'B0B5B5XP5B', 'B0B5B8LWNC', 'B08J7R2JX6', 'B0B59DVR1B', 'B0864HSLMN', 'B09SZQ1Z72', 'B08B123X15', 'B09H7GTZRL', 'B0B3LHK3GB', 'B09YYSX95N', 'B0B5BDDD74', 'B08KFCXL2M', 'B0B7P8X5GK', 'B07V8HCJJH', 'B09J1BFLDD', 'B09ZVB8YYC', 'B0BF5KCQBL', 'B0B5B8D6ZG', 'B0B5B7KFJ3', 'B08J7MHNYJ', 'B0B88LD167', 'B0B5B5X37Y', 'B07XRMXRK9', 'B0B5B651P2', 'B0B5B5FTR5', 'B018QE4SMC', 'B0B59C9M2Q', 'B09YYR7HH3', 'B09H7B3SZF', 'B09H77M3Y1', 'B00O48ZHMA', '1801227543', 'B0B5B6W3YK', 'B08J7Y42QT', 'B09XB4X9J5', 'B08J7LSZCW', 'B08J7LRFKC', 'B0BGLS8WDL', 'B08J85GZY2', 'B0BCZ7PFL7', 'B09KS5VZNM', 'B09XB5L4RM']","Based on the user's previous purchases and preferences, it seems that their current intent is to find a family calendar or planner for the upcoming year, specifically focusing on the colors pink, blue, birds, and berry. They are interested in family calendars with multiple columns for family members, birthdays, meal planning, pockets for storage, and stickers. The user prefers products from Busy B and Boxclever Press brands within a price range of $10.5 to $40,000,000.07. The materials used in the items are mostly paper, with some featuring metal components."
"['B08PC589QL', 'B08THP6Y71', 'B08THRFKWF', 'B08RG6L8N7', 'B08PC71W32', 'B09B28MTND', 'B08LSGB7DH', 'B01MDR6YQA', 'B08HG24FJW', 'B07CZXNZJP', 'B07X5M5BVZ', 'B08LSVPVY2', 'B097LPT9Q8', 'B08NX7H6L1', 'B09KQWH1W2', 'B003XJ7X8M', 'B09SBGSJ1N', 'B0992JCWG4', 'B0978PTQL6', 'B09VZ9DP67', 'B095KPPKC3', 'B0978R6W66', 'B08GXDJQSK', 'B0856JKBWG', 'B09Q3SYF8L', 'B07P43RZCK', 'B092J4ZV8W', 'B081TJ3JFX', 'B0BGLB8CJK', 'B09HKFBCTQ', 'B0BGPWMJK6', 'B07DL3RJ7D', 'B017IOKN52', 'B00LWU4U8K', 'B019W1Q0UG', 'B0BGR53QXL', 'B0B9NRFGMM', 'B07FP121MP', 'B09MD69Z35', 'B099P4RYGV', 'B07637HSJY', 'B087QP53X9', 'B0B1WYJ5WR', 'B082X2CK46', 'B081TKQDLJ', 'B078S6T2MW', 'B09KMB9HFH', 'B09PJJ8XJ4', 'B0B9XQQSPX', 'B00L979JEQ']","Based on the user's previous purchases and preferences, it seems that their current intent is to find another small portable fridge or cooler for storing drinks and skincare products. They are interested in models similar to the ones they have purchased before from brands like Russell Hobbs and Subcold. The preferred colors are Scandi White, Gray, Black, and Pink, and the price range is between $38.99 and $79.99."
